00:23:07.821365 IP 192.168.1.95.53418 > 91.189.94.4.123: NTPv4, Client, length 48
00:23:18.071398 IP 192.168.1.95.54633 > 91.189.89.198.123: NTPv4, Client, length 48
00:23:18.322471 IP 91.189.89.198.123 > 192.168.1.95.54633: NTPv4, Server, length 48
00:23:31.934636 IP 192.168.1.53 > 224.0.0.251: igmp v2 report 224.0.0.251
00:23:33.435864 IP 192.168.1.53 > 239.255.255.250: igmp v2 report 239.255.255.250
00:23:36.939622 IP 192.168.1.53 > 224.0.0.252: igmp v2 report 224.0.0.252
00:23:52.121675 IP 192.168.1.95.5353 > 224.0.0.251.5353: 0 [2q] PTR (QM)? _ipps._tcp.local. PTR (QM)? _ipp._tcp.local. (45)
00:24:39.217213 IP 192.168.1.95.5353 > 224.0.0.251.5353: 0 [7q] PTR (QM)? _ftp._tcp.local. PTR (QM)? _nfs._tcp.local. PTR (QM)? _afpovertcp._tcp.local. PTR (QM)? _smb._tcp.local. PTR (QM)? _sftp-ssh._tcp.local. PTR (QM)? _webdavs._tcp.local. PTR (QM)? _webdav._tcp.local. (118)
00:25:26.571453 IP 192.168.1.95.57175 > 91.189.89.198.123: NTPv4, Client, length 48
00:25:33.981614 IP 192.168.1.53 > 224.0.0.251: igmp v2 report 224.0.0.251
00:25:35.482726 IP 192.168.1.53 > 239.255.255.250: igmp v2 report 239.255.255.250
00:25:39.983067 IP 192.168.1.53 > 224.0.0.252: igmp v2 report 224.0.0.252
00:25:56.668100 IP 192.168.1.53.138 > 192.168.1.255.138: NBT UDP PACKET(138)
00:25:58.821310 IP 192.168.1.95.57175 > 91.189.89.198.123: NTPv4, Client, length 48
00:25:59.076566 IP 91.189.89.198.123 > 192.168.1.95.57175: NTPv4, Server, length 48
00:27:39.976141 IP 192.168.1.53 > 239.255.255.250: igmp v2 report 239.255.255.250
00:27:41.976584 IP 192.168.1.53 > 224.0.0.251: igmp v2 report 224.0.0.251
00:27:42.977494 IP 192.168.1.53 > 224.0.0.252: igmp v2 report 224.0.0.252
00:28:08.217865 IP 192.168.1.95.5353 > 224.0.0.251.5353: 0 [2q] PTR (QM)? _ipps._tcp.local. PTR (QM)? _ipp._tcp.local. (45)
00:28:55.249866 IP 192.168.1.95.5353 > 224.0.0.251.5353: 0 [7q] PTR (QM)? _ftp._tcp.local. PTR (QM)? _nfs._tcp.local. PTR (QM)? _afpovertcp._tcp.local. PTR (QM)? _smb._tcp.local. PTR (QM)? _sftp-ssh._tcp.local. PTR (QM)? _webdavs._tcp.local. PTR (QM)? _webdav._tcp.local. (118)
00:29:17.566608 IP 192.168.1.53 > 224.0.0.2: igmp leave 224.0.0.252
00:29:17.585264 IP 192.168.1.53 > 224.0.0.252: igmp v2 report 224.0.0.252
00:29:17.585487 IP 192.168.1.53 > 224.0.0.2: igmp leave 224.0.0.252
00:29:17.586051 IP 192.168.1.53 > 224.0.0.252: igmp v2 report 224.0.0.252
00:29:17.587970 IP 192.168.1.53.5353 > 224.0.0.251.5353: 0 ANY (QM)? DESKTOP-GA31KPN.local. (39)
00:29:17.590293 IP 192.168.1.53.60114 > 224.0.0.252.5355: UDP, length 33
00:29:17.590297 IP 192.168.1.53.5353 > 224.0.0.251.5353: 0*- [0q] 2/0/0 AAAA fe80::f56b:f4c9:df44:29f2, A 192.168.1.53 (77)
00:29:17.590303 IP 192.168.1.53.5353 > 224.0.0.251.5353: 0 ANY (QM)? DESKTOP-GA31KPN.local. (39)
00:29:17.591279 IP 192.168.1.53.5353 > 224.0.0.251.5353: 0*- [0q] 2/0/0 AAAA fe80::f56b:f4c9:df44:29f2, A 192.168.1.53 (77)
00:29:17.665141 IP 192.168.1.53 > 224.0.0.2: igmp leave 224.0.0.252
00:29:17.683627 IP 192.168.1.53 > 224.0.0.252: igmp v2 report 224.0.0.252
00:29:17.684027 IP 192.168.1.53 > 224.0.0.2: igmp leave 224.0.0.252
00:29:17.684191 IP 192.168.1.53 > 224.0.0.252: igmp v2 report 224.0.0.252
00:29:17.684686 IP 192.168.1.53.5353 > 224.0.0.251.5353: 0 ANY (QM)? DESKTOP-GA31KPN.local. (39)
00:29:17.685369 IP 192.168.1.53.56023 > 224.0.0.252.5355: UDP, length 33
00:29:17.685806 IP 192.168.1.53.5353 > 224.0.0.251.5353: 0 ANY (QM)? DESKTOP-GA31KPN.local. (39)
00:29:17.685813 IP 192.168.1.53.5353 > 224.0.0.251.5353: 0*- [0q] 2/0/0 AAAA fe80::f56b:f4c9:df44:29f2, A 192.168.1.53 (77)
00:29:17.686643 IP 192.168.1.53.5353 > 224.0.0.251.5353: 0*- [0q] 2/0/0 AAAA fe80::f56b:f4c9:df44:29f2, A 192.168.1.53 (77)
00:29:17.982051 IP 192.168.1.53 > 224.0.0.252: igmp v2 report 224.0.0.252
00:29:21.685609 IP 192.168.1.53 > 224.0.0.2: igmp leave 224.0.0.252
00:29:21.713018 IP 192.168.1.53 > 224.0.0.252: igmp v2 report 224.0.0.252
00:29:21.713871 IP 192.168.1.53 > 224.0.0.2: igmp leave 224.0.0.252
00:29:21.714210 IP 192.168.1.53 > 224.0.0.252: igmp v2 report 224.0.0.252
00:29:21.715511 IP 192.168.1.53.5353 > 224.0.0.251.5353: 0 ANY (QM)? DESKTOP-GA31KPN.local. (39)
00:29:21.716808 IP 192.168.1.53.5353 > 224.0.0.251.5353: 0*- [0q] 2/0/0 AAAA fe80::f56b:f4c9:df44:29f2, A 192.168.1.53 (77)
00:29:21.717159 IP 192.168.1.53.62014 > 224.0.0.252.5355: UDP, length 33
00:29:21.717757 IP 192.168.1.53.5353 > 224.0.0.251.5353: 0 ANY (QM)? DESKTOP-GA31KPN.local. (39)
00:29:21.720579 IP 192.168.1.53.5353 > 224.0.0.251.5353: 0*- [0q] 2/0/0 AAAA fe80::f56b:f4c9:df44:29f2, A 192.168.1.53 (77)
00:29:21.982492 IP 192.168.1.53 > 224.0.0.252: igmp v2 report 224.0.0.252
00:29:23.813158 IP 192.168.1.95.51695 > 192.168.1.1.53: 47528+ A? detectportal.firefox.com. (42)
00:29:23.813355 IP 192.168.1.95.51695 > 192.168.1.1.53: 18698+ AAAA? detectportal.firefox.com. (42)
00:29:23.851327 IP 192.168.1.1.53 > 192.168.1.95.51695: 47528 5/0/0 CNAME detectportal.prod.mozaws.net., CNAME detectportal.firefox.com-v2.edgesuite.net., CNAME a1089.dscd.akamai.net., A 184.51.15.135, A 184.51.15.141 (341)
00:29:23.906192 IP 192.168.1.1.53 > 192.168.1.95.51695: 18698 5/0/0 CNAME detectportal.prod.mozaws.net., CNAME detectportal.firefox.com-v2.edgesuite.net., CNAME a1089.dscd.akamai.net., AAAA 2600:1417:8000::b81c:da41, AAAA 2600:1417:8000::b81c:da3a (224)
00:29:23.907115 IP 192.168.1.95.39038 > 184.51.15.135.80: Flags [S], seq 1642136084, win 29200, options [mss 1460,sackOK,TS val 2542883179 ecr 0,nop,wscale 7], length 0
00:29:24.021753 IP 184.51.15.135.80 > 192.168.1.95.39038: Flags [S.], seq 3012705939, ack 1642136085, win 28960, options [mss 1452,sackOK,TS val 4024099409 ecr 2542883179,nop,wscale 7], length 0
00:29:24.021775 IP 192.168.1.95.39038 > 184.51.15.135.80: Flags [.], ack 1, win 229, options [nop,nop,TS val 2542883293 ecr 4024099409], length 0
00:29:24.022071 IP 192.168.1.95.39038 > 184.51.15.135.80: Flags [P.], seq 1:297, ack 1, win 229, options [nop,nop,TS val 2542883294 ecr 4024099409], length 296: HTTP: GET /success.txt HTTP/1.1
00:29:24.135150 IP 184.51.15.135.80 > 192.168.1.95.39038: Flags [.], ack 297, win 235, options [nop,nop,TS val 4024099523 ecr 2542883294], length 0
00:29:24.135162 IP 184.51.15.135.80 > 192.168.1.95.39038: Flags [P.], seq 1:385, ack 297, win 235, options [nop,nop,TS val 4024099524 ecr 2542883294], length 384: HTTP: HTTP/1.1 200 OK
00:29:24.135170 IP 192.168.1.95.39038 > 184.51.15.135.80: Flags [.], ack 385, win 237, options [nop,nop,TS val 2542883407 ecr 4024099524], length 0
00:29:30.369194 IP 192.168.1.95.51695 > 192.168.1.1.53: 8188+ A? tiles.services.mozilla.com. (44)
00:29:30.369393 IP 192.168.1.95.51695 > 192.168.1.1.53: 8257+ AAAA? tiles.services.mozilla.com. (44)
00:29:30.411253 IP 192.168.1.1.53 > 192.168.1.95.51695: 8188 9/0/0 CNAME tiles.r53-2.services.mozilla.com., A 52.34.107.172, A 52.26.103.165, A 52.41.78.152, A 52.43.40.243, A 35.160.41.125, A 52.25.70.97, A 52.39.131.77, A 35.164.130.113 (198)
00:29:30.461124 IP 192.168.1.1.53 > 192.168.1.95.51695: 8257 1/0/0 CNAME tiles.r53-2.services.mozilla.com. (70)
00:29:30.464398 IP 192.168.1.95.56534 > 52.34.107.172.443: Flags [S], seq 3861552171, win 29200, options [mss 1460,sackOK,TS val 4146761326 ecr 0,nop,wscale 7], length 0
00:29:30.700522 IP 192.168.1.95.51695 > 192.168.1.1.53: 37601+ A? snippets.cdn.mozilla.net. (42)
00:29:30.700718 IP 192.168.1.95.51695 > 192.168.1.1.53: 53319+ AAAA? snippets.cdn.mozilla.net. (42)
00:29:30.714738 IP 192.168.1.95.56536 > 52.34.107.172.443: Flags [S], seq 4250276674, win 29200, options [mss 1460,sackOK,TS val 4146761577 ecr 0,nop,wscale 7], length 0
00:29:30.755258 IP 52.34.107.172.443 > 192.168.1.95.56534: Flags [S.], seq 3995108354, ack 3861552172, win 26847, options [mss 1452,sackOK,TS val 3069636119 ecr 4146761326,nop,wscale 8], length 0
00:29:30.755391 IP 192.168.1.95.56534 > 52.34.107.172.443: Flags [.], ack 1, win 229, options [nop,nop,TS val 4146761617 ecr 3069636119], length 0
00:29:30.755995 IP 192.168.1.1.53 > 192.168.1.95.51695: 37601 2/0/0 CNAME drcwo519tnci7.cloudfront.net., A 52.85.151.12 (97)
00:29:30.756019 IP 192.168.1.1.53 > 192.168.1.95.51695: 53319 1/0/0 CNAME drcwo519tnci7.cloudfront.net. (81)
00:29:30.759029 IP 192.168.1.95.56534 > 52.34.107.172.443: Flags [P.], seq 1:518, ack 1, win 229, options [nop,nop,TS val 4146761621 ecr 3069636119], length 517
00:29:30.762769 IP 192.168.1.95.41166 > 52.85.151.12.443: Flags [S], seq 1237019124, win 29200, options [mss 1460,sackOK,TS val 549236068 ecr 0,nop,wscale 7], length 0
00:29:30.860801 IP 52.85.151.12.443 > 192.168.1.95.41166: Flags [R.], seq 0, ack 1237019125, win 4969, length 0
00:29:30.862589 IP 192.168.1.95.41168 > 52.85.151.12.443: Flags [S], seq 2289018438, win 29200, options [mss 1460,sackOK,TS val 549236167 ecr 0,nop,wscale 7], length 0
00:29:30.972654 IP 52.85.151.12.443 > 192.168.1.95.41168: Flags [R.], seq 0, ack 2289018439, win 4970, length 0
00:29:31.021009 IP 52.34.107.172.443 > 192.168.1.95.56536: Flags [S.], seq 1019675178, ack 4250276675, win 26847, options [mss 1452,sackOK,TS val 3069636183 ecr 4146761577,nop,wscale 8], length 0
00:29:31.021071 IP 192.168.1.95.56536 > 52.34.107.172.443: Flags [.], ack 1, win 229, options [nop,nop,TS val 4146761883 ecr 3069636183], length 0
00:29:31.021234 IP 52.34.107.172.443 > 192.168.1.95.56534: Flags [P.], seq 1429:3015, ack 518, win 117, options [nop,nop,TS val 3069636239 ecr 4146761621], length 1586
00:29:31.021243 IP 192.168.1.95.56534 > 52.34.107.172.443: Flags [.], ack 1, win 253, options [nop,nop,TS val 4146761883 ecr 3069636119,nop,nop,sack 1 {1429:3015}], length 0
00:29:31.021332 IP 52.34.107.172.443 > 192.168.1.95.56534: Flags [.], seq 1:1429, ack 518, win 117, options [nop,nop,TS val 3069636239 ecr 4146761621], length 1428
00:29:31.021338 IP 192.168.1.95.56534 > 52.34.107.172.443: Flags [.], ack 3015, win 276, options [nop,nop,TS val 4146761883 ecr 3069636239], length 0
00:29:31.050339 IP 192.168.1.95.56534 > 52.34.107.172.443: Flags [P.], seq 518:644, ack 3015, win 276, options [nop,nop,TS val 4146761912 ecr 3069636239], length 126
00:29:31.052111 IP 192.168.1.95.56536 > 52.34.107.172.443: Flags [P.], seq 1:518, ack 1, win 229, options [nop,nop,TS val 4146761914 ecr 3069636183], length 517
00:29:31.123138 IP 192.168.1.95.51695 > 192.168.1.1.53: 31511+ A? ocsp.digicert.com. (35)
00:29:31.123420 IP 192.168.1.95.51695 > 192.168.1.1.53: 9306+ AAAA? ocsp.digicert.com. (35)
00:29:31.180840 IP 192.168.1.1.53 > 192.168.1.95.51695: 31511 2/0/0 CNAME cs9.wac.phicdn.net., A 117.18.237.29 (83)
00:29:31.181867 IP 192.168.1.1.53 > 192.168.1.95.51695: 9306 1/0/0 CNAME cs9.wac.phicdn.net. (67)
00:29:31.182076 IP 192.168.1.95.41218 > 117.18.237.29.80: Flags [S], seq 2309106489, win 29200, options [mss 1460,sackOK,TS val 2078778819 ecr 0,nop,wscale 7], length 0
00:29:31.340842 IP 52.34.107.172.443 > 192.168.1.95.56534: Flags [P.], seq 3015:3066, ack 644, win 117, options [nop,nop,TS val 3069636316 ecr 4146761912], length 51
00:29:31.340856 IP 52.34.107.172.443 > 192.168.1.95.56536: Flags [.], ack 518, win 117, options [nop,nop,TS val 3069636315 ecr 4146761914], length 0
00:29:31.384844 IP 192.168.1.95.56534 > 52.34.107.172.443: Flags [.], ack 3066, win 276, options [nop,nop,TS val 4146762247 ecr 3069636316], length 0
00:29:31.391303 IP 52.34.107.172.443 > 192.168.1.95.56536: Flags [P.], seq 1:3015, ack 518, win 117, options [nop,nop,TS val 3069636316 ecr 4146761914], length 3014
00:29:31.391408 IP 192.168.1.95.56536 > 52.34.107.172.443: Flags [.], ack 3015, win 276, options [nop,nop,TS val 4146762253 ecr 3069636316], length 0
00:29:31.401696 IP 192.168.1.95.56536 > 52.34.107.172.443: Flags [P.], seq 518:644, ack 3015, win 276, options [nop,nop,TS val 4146762263 ecr 3069636316], length 126
00:29:31.413492 IP 192.168.1.95.41220 > 117.18.237.29.80: Flags [S], seq 2940711838, win 29200, options [mss 1460,sackOK,TS val 2078779050 ecr 0,nop,wscale 7], length 0
00:29:31.432541 IP 192.168.1.95.41222 > 117.18.237.29.80: Flags [S], seq 1982223706, win 29200, options [mss 1460,sackOK,TS val 2078779069 ecr 0,nop,wscale 7], length 0
00:29:31.552756 IP 117.18.237.29.80 > 192.168.1.95.41220: Flags [S.], seq 1562505383, ack 2940711839, win 65535, options [mss 1452,sackOK,TS val 2419699598 ecr 2078779050,nop,wscale 9], length 0
00:29:31.552789 IP 192.168.1.95.41220 > 117.18.237.29.80: Flags [.], ack 1, win 229, options [nop,nop,TS val 2078779190 ecr 2419699598], length 0
00:29:31.553182 IP 192.168.1.95.41220 > 117.18.237.29.80: Flags [P.], seq 1:451, ack 1, win 229, options [nop,nop,TS val 2078779190 ecr 2419699598], length 450: HTTP: POST / HTTP/1.1
00:29:31.650646 IP 117.18.237.29.80 > 192.168.1.95.41222: Flags [S.], seq 982355349, ack 1982223707, win 65535, options [mss 1452,sackOK,TS val 3831730292 ecr 2078779069,nop,wscale 9], length 0
00:29:31.651037 IP 192.168.1.95.41222 > 117.18.237.29.80: Flags [.], ack 1, win 229, options [nop,nop,TS val 2078779288 ecr 3831730292], length 0
00:29:31.654230 IP 192.168.1.95.41222 > 117.18.237.29.80: Flags [P.], seq 1:451, ack 1, win 229, options [nop,nop,TS val 2078779291 ecr 3831730292], length 450: HTTP: POST / HTTP/1.1
00:29:31.691117 IP 117.18.237.29.80 > 192.168.1.95.41220: Flags [.], ack 451, win 285, options [nop,nop,TS val 2419699736 ecr 2078779190], length 0
00:29:31.691531 IP 117.18.237.29.80 > 192.168.1.95.41220: Flags [P.], seq 1:789, ack 451, win 285, options [nop,nop,TS val 2419699736 ecr 2078779190], length 788: HTTP: HTTP/1.1 200 OK
00:29:31.691555 IP 192.168.1.95.41220 > 117.18.237.29.80: Flags [.], ack 789, win 241, options [nop,nop,TS val 2078779328 ecr 2419699736], length 0
00:29:31.696936 IP 192.168.1.95.56534 > 52.34.107.172.443: Flags [P.], seq 644:1221, ack 3066, win 276, options [nop,nop,TS val 4146762559 ecr 3069636316], length 577
00:29:31.741323 IP 52.34.107.172.443 > 192.168.1.95.56536: Flags [P.], seq 3015:3066, ack 644, win 117, options [nop,nop,TS val 3069636408 ecr 4146762263], length 51
00:29:31.785736 IP 192.168.1.95.56536 > 52.34.107.172.443: Flags [.], ack 3066, win 276, options [nop,nop,TS val 4146762647 ecr 3069636408], length 0
00:29:31.841670 IP 117.18.237.29.80 > 192.168.1.95.41222: Flags [.], ack 451, win 285, options [nop,nop,TS val 3831730514 ecr 2078779291], length 0
00:29:31.841823 IP 117.18.237.29.80 > 192.168.1.95.41222: Flags [P.], seq 1:789, ack 451, win 285, options [nop,nop,TS val 3831730514 ecr 2078779291], length 788: HTTP: HTTP/1.1 200 OK
00:29:31.841837 IP 192.168.1.95.41222 > 117.18.237.29.80: Flags [.], ack 789, win 241, options [nop,nop,TS val 2078779479 ecr 3831730514], length 0
00:29:32.041038 IP 52.34.107.172.443 > 192.168.1.95.56534: Flags [P.], seq 3066:3276, ack 1221, win 122, options [nop,nop,TS val 3069636485 ecr 4146762559], length 210
00:29:32.041194 IP 192.168.1.95.56534 > 52.34.107.172.443: Flags [.], ack 3276, win 298, options [nop,nop,TS val 4146762903 ecr 3069636485], length 0
00:29:32.213035 IP 192.168.1.95.41218 > 117.18.237.29.80: Flags [S], seq 2309106489, win 29200, options [mss 1460,sackOK,TS val 2078779850 ecr 0,nop,wscale 7], length 0
00:29:32.400810 IP 117.18.237.29.80 > 192.168.1.95.41218: Flags [S.], seq 2278003845, ack 2309106490, win 65535, options [mss 1452,sackOK,TS val 1030561072 ecr 2078778819,nop,wscale 9], length 0
00:29:32.400843 IP 192.168.1.95.41218 > 117.18.237.29.80: Flags [.], ack 1, win 229, options [nop,nop,TS val 2078780037 ecr 1030561072], length 0
00:29:32.401327 IP 117.18.237.29.80 > 192.168.1.95.41218: Flags [S.], seq 2278003845, ack 2309106490, win 65535, options [mss 1452,sackOK,TS val 1030561092 ecr 2078778819,nop,wscale 9], length 0
00:29:32.401348 IP 192.168.1.95.41218 > 117.18.237.29.80: Flags [.], ack 1, win 229, options [nop,nop,TS val 2078780038 ecr 1030561072], length 0
00:29:32.502760 IP 192.168.1.95.51695 > 192.168.1.1.53: 58796+ A? www.baidu.com. (31)
00:29:32.502910 IP 192.168.1.95.51695 > 192.168.1.1.53: 20554+ AAAA? www.baidu.com. (31)
00:29:32.562080 IP 192.168.1.1.53 > 192.168.1.95.51695: 58796 3/0/0 CNAME www.a.shifen.com., A 183.232.231.172, A 183.232.231.173 (90)
00:29:32.562112 IP 192.168.1.1.53 > 192.168.1.95.51695: 20554 1/0/0 CNAME www.a.shifen.com. (58)
00:29:32.562478 IP 192.168.1.95.51695 > 192.168.1.1.53: 25363+ A? www.youtube.com. (33)
00:29:32.562721 IP 192.168.1.95.51695 > 192.168.1.1.53: 20786+ AAAA? www.youtube.com. (33)
00:29:32.601394 IP 192.168.1.1.53 > 192.168.1.95.51695: 25363* 1/0/0 A 218.207.212.70 (49)
00:29:32.601409 IP 192.168.1.1.53 > 192.168.1.95.51695: 20786 2/0/0 CNAME youtube-ui.l.google.com., AAAA 2404:6800:4005:811::200e (95)
00:29:32.601861 IP 192.168.1.95.51695 > 192.168.1.1.53: 33517+ A? www.facebook.com. (34)
00:29:32.602089 IP 192.168.1.95.51695 > 192.168.1.1.53: 49006+ AAAA? www.facebook.com. (34)
00:29:32.643310 IP 192.168.1.1.53 > 192.168.1.95.51695: 33517* 1/0/0 A 218.207.212.70 (50)
00:29:34.196772 IP 192.168.1.95.39038 > 184.51.15.135.80: Flags [.], ack 385, win 237, options [nop,nop,TS val 2542893467 ecr 4024099524], length 0
00:29:34.310569 IP 184.51.15.135.80 > 192.168.1.95.39038: Flags [.], ack 297, win 235, options [nop,nop,TS val 4024109698 ecr 2542883407], length 0
00:29:36.765180 IP 192.168.1.95.56536 > 52.34.107.172.443: Flags [P.], seq 644:675, ack 3066, win 276, options [nop,nop,TS val 4146767626 ecr 3069636408], length 31
00:29:36.765380 IP 192.168.1.95.56536 > 52.34.107.172.443: Flags [F.], seq 675, ack 3066, win 276, options [nop,nop,TS val 4146767627 ecr 3069636408], length 0
00:29:37.099044 IP 52.34.107.172.443 > 192.168.1.95.56536: Flags [F.], seq 3097, ack 675, win 117, options [nop,nop,TS val 3069637750 ecr 4146767626], length 0
00:29:37.099190 IP 192.168.1.95.56536 > 52.34.107.172.443: Flags [R], seq 4250277349, win 0, length 0
00:29:37.099315 IP 52.34.107.172.443 > 192.168.1.95.56536: Flags [.], ack 676, win 117, options [nop,nop,TS val 3069637750 ecr 4146767627], length 0
00:29:37.099320 IP 192.168.1.95.56536 > 52.34.107.172.443: Flags [R], seq 4250277350, win 0, length 0
00:29:37.099389 IP 52.34.107.172.443 > 192.168.1.95.56536: Flags [P.], seq 3066:3097, ack 675, win 117, options [nop,nop,TS val 3069637750 ecr 4146767626], length 31
00:29:37.099395 IP 192.168.1.95.56536 > 52.34.107.172.443: Flags [R], seq 4250277349, win 0, length 0
00:29:37.607416 IP 192.168.1.95.51695 > 192.168.1.1.53: 18388+ A? www.facebook.com. (34)
00:29:37.650861 IP 192.168.1.1.53 > 192.168.1.95.51695: 18388* 1/0/0 A 218.207.212.70 (50)
00:29:37.650995 IP 192.168.1.95.51695 > 192.168.1.1.53: 49006+ AAAA? www.facebook.com. (34)
00:29:37.765589 IP 192.168.1.95.41218 > 117.18.237.29.80: Flags [F.], seq 1, ack 1, win 229, options [nop,nop,TS val 2078785402 ecr 1030561072], length 0
00:29:37.991376 IP 117.18.237.29.80 > 192.168.1.95.41218: Flags [F.], seq 1, ack 2, win 283, options [nop,nop,TS val 1030566645 ecr 2078785402], length 0
00:29:37.991402 IP 192.168.1.95.41218 > 117.18.237.29.80: Flags [.], ack 2, win 229, options [nop,nop,TS val 2078785628 ecr 1030566645], length 0
00:29:41.479727 IP 192.168.1.95.40954 > 183.232.231.172.443: Flags [S], seq 1613951003, win 29200, options [mss 1460,sackOK,TS val 1407790705 ecr 0,nop,wscale 7], length 0
00:29:41.511751 IP 183.232.231.172.443 > 192.168.1.95.40954: Flags [S.], seq 3249508751, ack 1613951004, win 8192, options [mss 1452,sackOK,nop,nop,nop,nop,nop,nop,nop,nop,nop,nop,nop,wscale 5], length 0
00:29:41.511838 IP 192.168.1.95.40954 > 183.232.231.172.443: Flags [.], ack 1, win 229, length 0
00:29:41.513354 IP 192.168.1.95.40954 > 183.232.231.172.443: Flags [P.], seq 1:518, ack 1, win 229, length 517
00:29:41.531526 IP 192.168.1.95.40956 > 183.232.231.172.443: Flags [S], seq 4109518854, win 29200, options [mss 1460,sackOK,TS val 1407790756 ecr 0,nop,wscale 7], length 0
00:29:41.536761 IP 192.168.1.95.56534 > 52.34.107.172.443: Flags [P.], seq 1221:2033, ack 3276, win 298, options [nop,nop,TS val 4146772398 ecr 3069636485], length 812
00:29:41.546520 IP 192.168.1.95.40958 > 183.232.231.172.443: Flags [S], seq 3144664902, win 29200, options [mss 1460,sackOK,TS val 1407790771 ecr 0,nop,wscale 7], length 0
00:29:41.557280 IP 183.232.231.172.443 > 192.168.1.95.40954: Flags [.], ack 518, win 812, length 0
00:29:41.558155 IP 183.232.231.172.443 > 192.168.1.95.40954: Flags [P.], seq 1:69, ack 518, win 812, length 68
00:29:41.558167 IP 192.168.1.95.40954 > 183.232.231.172.443: Flags [.], ack 69, win 229, length 0
00:29:41.558259 IP 183.232.231.172.443 > 192.168.1.95.40954: Flags [.], seq 69:1521, ack 518, win 812, length 1452
00:29:41.558263 IP 192.168.1.95.40954 > 183.232.231.172.443: Flags [.], ack 1521, win 251, length 0
00:29:41.558308 IP 183.232.231.172.443 > 192.168.1.95.40954: Flags [P.], seq 2973:3575, ack 518, win 812, length 602
00:29:41.558313 IP 192.168.1.95.40954 > 183.232.231.172.443: Flags [.], ack 1521, win 274, options [nop,nop,sack 1 {2973:3575}], length 0
00:29:41.559527 IP 183.232.231.172.443 > 192.168.1.95.40954: Flags [.], seq 1521:2973, ack 518, win 812, length 1452
00:29:41.559589 IP 192.168.1.95.40954 > 183.232.231.172.443: Flags [.], ack 3575, win 297, length 0
00:29:41.559692 IP 183.232.231.172.443 > 192.168.1.95.40954: Flags [P.], seq 3575:3913, ack 518, win 812, length 338
00:29:41.559702 IP 192.168.1.95.40954 > 183.232.231.172.443: Flags [.], ack 3913, win 320, length 0
00:29:41.559751 IP 183.232.231.172.443 > 192.168.1.95.40954: Flags [P.], seq 3913:3922, ack 518, win 812, length 9
00:29:41.559754 IP 192.168.1.95.40954 > 183.232.231.172.443: Flags [.], ack 3922, win 320, length 0
00:29:41.562726 IP 192.168.1.95.40954 > 183.232.231.172.443: Flags [P.], seq 518:644, ack 3922, win 320, length 126
00:29:41.601554 IP 183.232.231.172.443 > 192.168.1.95.40956: Flags [S.], seq 1825231346, ack 4109518855, win 8192, options [mss 1452,sackOK,nop,nop,nop,nop,nop,nop,nop,nop,nop,nop,nop,wscale 5], length 0
00:29:41.601577 IP 192.168.1.95.40956 > 183.232.231.172.443: Flags [.], ack 1, win 229, length 0
00:29:41.601952 IP 183.232.231.172.443 > 192.168.1.95.40958: Flags [S.], seq 3813050224, ack 3144664903, win 8192, options [mss 1452,sackOK,nop,nop,nop,nop,nop,nop,nop,nop,nop,nop,nop,wscale 5], length 0
00:29:41.601960 IP 192.168.1.95.40958 > 183.232.231.172.443: Flags [.], ack 1, win 229, length 0
00:29:41.602081 IP 183.232.231.172.443 > 192.168.1.95.40954: Flags [.], ack 644, win 812, length 0
00:29:41.602087 IP 183.232.231.172.443 > 192.168.1.95.40954: Flags [P.], seq 3922:4097, ack 644, win 812, length 175
00:29:41.602091 IP 183.232.231.172.443 > 192.168.1.95.40954: Flags [P.], seq 4097:4103, ack 644, win 812, length 6
00:29:41.602093 IP 183.232.231.172.443 > 192.168.1.95.40954: Flags [P.], seq 4103:4148, ack 644, win 812, length 45
00:29:41.602348 IP 192.168.1.95.40954 > 183.232.231.172.443: Flags [.], ack 4148, win 342, length 0
00:29:41.603313 IP 192.168.1.95.40956 > 183.232.231.172.443: Flags [P.], seq 1:518, ack 1, win 229, length 517
00:29:41.604331 IP 192.168.1.95.40958 > 183.232.231.172.443: Flags [P.], seq 1:518, ack 1, win 229, length 517
00:29:41.688632 IP 183.232.231.172.443 > 192.168.1.95.40958: Flags [.], ack 518, win 812, length 0
00:29:41.688686 IP 183.232.231.172.443 > 192.168.1.95.40958: Flags [P.], seq 1:69, ack 518, win 812, length 68
00:29:41.688693 IP 192.168.1.95.40958 > 183.232.231.172.443: Flags [.], ack 69, win 229, length 0
00:29:41.688821 IP 183.232.231.172.443 > 192.168.1.95.40958: Flags [P.], seq 2973:3575, ack 518, win 812, length 602
00:29:41.688826 IP 192.168.1.95.40958 > 183.232.231.172.443: Flags [.], ack 69, win 238, options [nop,nop,sack 1 {2973:3575}], length 0
00:29:41.688878 IP 183.232.231.172.443 > 192.168.1.95.40956: Flags [.], ack 518, win 812, length 0
00:29:41.688883 IP 183.232.231.172.443 > 192.168.1.95.40958: Flags [.], seq 69:2973, ack 518, win 812, length 2904
00:29:41.688887 IP 192.168.1.95.40958 > 183.232.231.172.443: Flags [.], ack 3575, win 283, length 0
00:29:41.688928 IP 183.232.231.172.443 > 192.168.1.95.40958: Flags [P.], seq 3575:3913, ack 518, win 812, length 338
00:29:41.688933 IP 192.168.1.95.40958 > 183.232.231.172.443: Flags [.], ack 3913, win 306, length 0
00:29:41.689539 IP 183.232.231.172.443 > 192.168.1.95.40958: Flags [P.], seq 3913:3922, ack 518, win 812, length 9
00:29:41.689548 IP 192.168.1.95.40958 > 183.232.231.172.443: Flags [.], ack 3922, win 306, length 0
00:29:41.689686 IP 183.232.231.172.443 > 192.168.1.95.40956: Flags [P.], seq 1:69, ack 518, win 812, length 68
00:29:41.689691 IP 192.168.1.95.40956 > 183.232.231.172.443: Flags [.], ack 69, win 229, length 0
00:29:41.689774 IP 183.232.231.172.443 > 192.168.1.95.40956: Flags [.], seq 69:1521, ack 518, win 812, length 1452
00:29:41.689778 IP 192.168.1.95.40956 > 183.232.231.172.443: Flags [.], ack 1521, win 251, length 0
00:29:41.689842 IP 183.232.231.172.443 > 192.168.1.95.40956: Flags [P.], seq 2973:3575, ack 518, win 812, length 602
00:29:41.689846 IP 192.168.1.95.40956 > 183.232.231.172.443: Flags [.], ack 1521, win 274, options [nop,nop,sack 1 {2973:3575}], length 0
00:29:41.689916 IP 183.232.231.172.443 > 192.168.1.95.40956: Flags [.], seq 1521:2973, ack 518, win 812, length 1452
00:29:41.689921 IP 192.168.1.95.40956 > 183.232.231.172.443: Flags [.], ack 3575, win 297, length 0
00:29:41.689966 IP 183.232.231.172.443 > 192.168.1.95.40956: Flags [P.], seq 3575:3913, ack 518, win 812, length 338
00:29:41.690000 IP 192.168.1.95.40956 > 183.232.231.172.443: Flags [.], ack 3913, win 320, length 0
00:29:41.690042 IP 183.232.231.172.443 > 192.168.1.95.40956: Flags [P.], seq 3913:3922, ack 518, win 812, length 9
00:29:41.690045 IP 192.168.1.95.40956 > 183.232.231.172.443: Flags [.], ack 3922, win 320, length 0
00:29:41.692244 IP 192.168.1.95.40956 > 183.232.231.172.443: Flags [P.], seq 518:644, ack 3922, win 320, length 126
00:29:41.692743 IP 192.168.1.95.41220 > 117.18.237.29.80: Flags [.], ack 789, win 241, options [nop,nop,TS val 2078789329 ecr 2419699736], length 0
00:29:41.698829 IP 192.168.1.95.40958 > 183.232.231.172.443: Flags [P.], seq 518:644, ack 3922, win 306, length 126
00:29:41.712645 IP 192.168.1.95.51695 > 192.168.1.1.53: 58629+ A? ocsp2.globalsign.com. (38)
00:29:41.713728 IP 192.168.1.95.51695 > 192.168.1.1.53: 56976+ AAAA? ocsp2.globalsign.com. (38)
00:29:41.729189 IP 183.232.231.172.443 > 192.168.1.95.40956: Flags [.], ack 644, win 812, length 0
00:29:41.730116 IP 183.232.231.172.443 > 192.168.1.95.40956: Flags [P.], seq 3922:4097, ack 644, win 812, length 175
00:29:41.730123 IP 183.232.231.172.443 > 192.168.1.95.40956: Flags [P.], seq 4097:4103, ack 644, win 812, length 6
00:29:41.730126 IP 183.232.231.172.443 > 192.168.1.95.40958: Flags [.], seq 69:2973, ack 518, win 812, length 2904
00:29:41.730132 IP 192.168.1.95.40958 > 183.232.231.172.443: Flags [.], ack 3922, win 306, options [nop,nop,sack 1 {69:2973}], length 0
00:29:41.730308 IP 192.168.1.95.40956 > 183.232.231.172.443: Flags [.], ack 4103, win 342, length 0
00:29:41.730394 IP 183.232.231.172.443 > 192.168.1.95.40958: Flags [.], ack 644, win 812, length 0
00:29:41.730397 IP 183.232.231.172.443 > 192.168.1.95.40956: Flags [P.], seq 4103:4148, ack 644, win 812, length 45
00:29:41.730716 IP 183.232.231.172.443 > 192.168.1.95.40958: Flags [P.], seq 3922:4097, ack 644, win 812, length 175
00:29:41.730721 IP 192.168.1.95.40958 > 183.232.231.172.443: Flags [.], ack 4097, win 329, length 0
00:29:41.762114 IP 183.232.231.172.443 > 192.168.1.95.40958: Flags [P.], seq 4097:4103, ack 644, win 812, length 6
00:29:41.762131 IP 192.168.1.95.40958 > 183.232.231.172.443: Flags [.], ack 4103, win 329, length 0
00:29:41.762251 IP 183.232.231.172.443 > 192.168.1.95.40958: Flags [P.], seq 4103:4148, ack 644, win 812, length 45
00:29:41.762255 IP 192.168.1.95.40958 > 183.232.231.172.443: Flags [.], ack 4148, win 329, length 0
00:29:41.762580 IP 192.168.1.1.53 > 192.168.1.95.51695: 58629 10/0/0 CNAME global.prd.cdn.globalsign.com., CNAME globalsign.com.w.kunlunar.com., A 183.218.12.241, A 183.218.12.242, A 183.218.12.243, A 183.218.12.244, A 183.218.12.245, A 183.218.12.246, A 183.218.12.248, A 183.218.12.249 (533)
00:29:41.762589 IP 192.168.1.1.53 > 192.168.1.95.51695: 56976 2/0/0 CNAME global.prd.cdn.globalsign.com., CNAME globalsign.com.w.kunlunar.com. (173)
00:29:41.763052 IP 192.168.1.95.51695 > 192.168.1.1.53: 27586+ A? www.wikipedia.org. (35)
00:29:41.763164 IP 192.168.1.95.55794 > 183.218.12.241.80: Flags [S], seq 3015870499, win 29200, options [mss 1460,sackOK,TS val 2801505025 ecr 0,nop,wscale 7], length 0
00:29:41.763235 IP 192.168.1.95.55796 > 183.218.12.241.80: Flags [S], seq 1195249356, win 29200, options [mss 1460,sackOK,TS val 2801505025 ecr 0,nop,wscale 7], length 0
00:29:41.763300 IP 192.168.1.95.55798 > 183.218.12.241.80: Flags [S], seq 4236198296, win 29200, options [mss 1460,sackOK,TS val 2801505025 ecr 0,nop,wscale 7], length 0
00:29:41.763381 IP 192.168.1.95.51695 > 192.168.1.1.53: 20482+ AAAA? www.wikipedia.org. (35)
00:29:41.772986 IP 192.168.1.95.40956 > 183.232.231.172.443: Flags [.], ack 4148, win 342, length 0
00:29:41.831526 IP 183.218.12.241.80 > 192.168.1.95.55794: Flags [S.], seq 3058633448, ack 3015870500, win 29200, options [mss 1452,nop,nop,sackOK,nop,wscale 9], length 0
00:29:41.831548 IP 192.168.1.95.55794 > 183.218.12.241.80: Flags [.], ack 1, win 229, length 0
00:29:41.831848 IP 192.168.1.95.55794 > 183.218.12.241.80: Flags [P.], seq 1:473, ack 1, win 229, length 472: HTTP: POST /gsorganizationvalsha2g2 HTTP/1.1
00:29:41.832417 IP 117.18.237.29.80 > 192.168.1.95.41220: Flags [.], ack 451, win 285, options [nop,nop,TS val 2419709874 ecr 2078779328], length 0
00:29:41.832423 IP 192.168.1.1.53 > 192.168.1.95.51695: 27586 1/0/1 A 198.35.26.96 (79)
00:29:41.832466 IP 192.168.1.1.53 > 192.168.1.95.51695: 20482 1/0/0 AAAA 2620:0:863:ed1a::1 (63)
00:29:41.832469 IP 183.218.12.241.80 > 192.168.1.95.55796: Flags [S.], seq 3881937090, ack 1195249357, win 29200, options [mss 1452,nop,nop,sackOK,nop,wscale 9], length 0
00:29:41.832478 IP 192.168.1.95.55796 > 183.218.12.241.80: Flags [.], ack 1, win 229, length 0
00:29:41.832544 IP 183.218.12.241.80 > 192.168.1.95.55798: Flags [S.], seq 1883003584, ack 4236198297, win 29200, options [mss 1452,nop,nop,sackOK,nop,wscale 9], length 0
00:29:41.832550 IP 192.168.1.95.55798 > 183.218.12.241.80: Flags [.], ack 1, win 229, length 0
00:29:41.832927 IP 192.168.1.95.51695 > 192.168.1.1.53: 33106+ A? www.reddit.com. (32)
00:29:41.833019 IP 192.168.1.95.51695 > 192.168.1.1.53: 119+ AAAA? www.reddit.com. (32)
00:29:41.833157 IP 192.168.1.95.55798 > 183.218.12.241.80: Flags [P.], seq 1:473, ack 1, win 229, length 472: HTTP: POST /gsorganizationvalsha2g2 HTTP/1.1
00:29:41.833280 IP 192.168.1.95.55796 > 183.218.12.241.80: Flags [P.], seq 1:473, ack 1, win 229, length 472: HTTP: POST /gsorganizationvalsha2g2 HTTP/1.1
00:29:41.876645 IP 192.168.1.95.41222 > 117.18.237.29.80: Flags [.], ack 789, win 241, options [nop,nop,TS val 2078789512 ecr 3831730514], length 0
00:29:41.881335 IP 52.34.107.172.443 > 192.168.1.95.56534: Flags [P.], seq 3276:3486, ack 2033, win 128, options [nop,nop,TS val 3069638943 ecr 4146772398], length 210
00:29:41.881375 IP 192.168.1.95.56534 > 52.34.107.172.443: Flags [.], ack 3486, win 321, options [nop,nop,TS val 4146772742 ecr 3069638943], length 0
00:29:41.881586 IP 192.168.1.1.53 > 192.168.1.95.51695: 33106 1/0/0 A 31.13.68.1 (62)
00:29:41.882726 IP 183.218.12.241.80 > 192.168.1.95.55794: Flags [.], ack 473, win 60, length 0
00:29:41.882736 IP 192.168.1.1.53 > 192.168.1.95.51695: 119 1/0/0 A 69.63.176.143 (62)
00:29:41.883116 IP 192.168.1.95.51695 > 192.168.1.1.53: 28010+ A? www.amazon.com. (32)
00:29:41.883303 IP 192.168.1.95.51695 > 192.168.1.1.53: 42318+ AAAA? www.amazon.com. (32)
00:29:41.921490 IP 183.218.12.241.80 > 192.168.1.95.55796: Flags [.], ack 473, win 60, length 0
00:29:41.921507 IP 183.218.12.241.80 > 192.168.1.95.55798: Flags [.], ack 473, win 60, length 0
00:29:41.922154 IP 183.218.12.241.80 > 192.168.1.95.55794: Flags [P.], seq 1:2340, ack 473, win 60, length 2339: HTTP: HTTP/1.1 200 OK
00:29:41.922186 IP 192.168.1.95.55794 > 183.218.12.241.80: Flags [.], ack 2340, win 265, length 0
00:29:41.922779 IP 183.218.12.241.80 > 192.168.1.95.55798: Flags [P.], seq 1:2336, ack 473, win 60, length 2335: HTTP: HTTP/1.1 200 OK
00:29:41.922793 IP 192.168.1.95.55798 > 183.218.12.241.80: Flags [.], ack 2336, win 265, length 0
00:29:41.923943 IP 183.218.12.241.80 > 192.168.1.95.55796: Flags [P.], seq 1:2340, ack 473, win 60, length 2339: HTTP: HTTP/1.1 200 OK
00:29:41.923955 IP 192.168.1.95.55796 > 183.218.12.241.80: Flags [.], ack 2340, win 265, length 0
00:29:41.924053 IP 192.168.1.1.53 > 192.168.1.95.51695: 28010 3/0/0 CNAME www.cdn.amazon.com., CNAME d3ag4hukkh62yn.cloudfront.net., A 13.35.14.29 (113)
00:29:41.930970 IP 192.168.1.95.40956 > 183.232.231.172.443: Flags [P.], seq 644:1139, ack 4148, win 342, length 495
00:29:41.972815 IP 192.168.1.1.53 > 192.168.1.95.51695: 42318 3/0/0 CNAME www.cdn.amazon.com., CNAME www.amazon.com.edgekey.net., CNAME e15316.ci.akamaiedge.net. (200)
00:29:41.973315 IP 183.232.231.172.443 > 192.168.1.95.40956: Flags [.], ack 1139, win 844, length 0
00:29:41.973431 IP 192.168.1.95.51695 > 192.168.1.1.53: 23839+ A? twitter.com. (29)
00:29:41.973707 IP 192.168.1.95.51695 > 192.168.1.1.53: 39555+ AAAA? twitter.com. (29)
00:29:41.975726 IP 183.232.231.172.443 > 192.168.1.95.40956: Flags [.], seq 4148:7052, ack 1139, win 844, length 2904
00:29:41.975737 IP 192.168.1.95.40956 > 183.232.231.172.443: Flags [.], ack 7052, win 388, length 0
00:29:41.977113 IP 183.232.231.172.443 > 192.168.1.95.40956: Flags [P.], seq 7052:8177, ack 1139, win 844, length 1125
00:29:41.977119 IP 192.168.1.95.40956 > 183.232.231.172.443: Flags [.], ack 8177, win 410, length 0
00:29:41.977178 IP 183.232.231.172.443 > 192.168.1.95.40956: Flags [P.], seq 8177:8302, ack 1139, win 844, length 125
00:29:41.977195 IP 192.168.1.95.40956 > 183.232.231.172.443: Flags [.], ack 8302, win 410, length 0
00:29:41.977308 IP 183.232.231.172.443 > 192.168.1.95.40956: Flags [P.], seq 8302:8332, ack 1139, win 844, length 30
00:29:41.977312 IP 192.168.1.95.40956 > 183.232.231.172.443: Flags [.], ack 8332, win 410, length 0
00:29:42.021432 IP 183.232.231.172.443 > 192.168.1.95.40956: Flags [.], seq 8332:9784, ack 1139, win 844, length 1452
00:29:42.021449 IP 192.168.1.95.40956 > 183.232.231.172.443: Flags [.], ack 9784, win 433, length 0
00:29:42.022416 IP 192.168.1.1.53 > 192.168.1.95.51695: 23839 1/0/0 A 69.171.224.12 (45)
00:29:42.022461 IP 192.168.1.1.53 > 192.168.1.95.51695: 39555 0/0/0 (29)
00:29:42.023048 IP 183.232.231.172.443 > 192.168.1.95.40956: Flags [.], seq 12688:15592, ack 1139, win 844, length 2904
00:29:42.023059 IP 192.168.1.95.40956 > 183.232.231.172.443: Flags [.], ack 9784, win 479, options [nop,nop,sack 1 {12688:15592}], length 0
00:29:42.023457 IP 183.232.231.172.443 > 192.168.1.95.40956: Flags [.], seq 9784:12688, ack 1139, win 844, length 2904
00:29:42.023484 IP 192.168.1.95.40956 > 183.232.231.172.443: Flags [.], ack 15592, win 524, length 0
00:29:42.024727 IP 183.232.231.172.443 > 192.168.1.95.40956: Flags [.], seq 15592:18496, ack 1139, win 844, length 2904
00:29:42.024738 IP 192.168.1.95.40956 > 183.232.231.172.443: Flags [.], ack 18496, win 569, length 0
00:29:42.025155 IP 183.232.231.172.443 > 192.168.1.95.40956: Flags [.], seq 18496:19948, ack 1139, win 844, length 1452
00:29:42.025161 IP 192.168.1.95.40956 > 183.232.231.172.443: Flags [.], ack 19948, win 592, length 0
00:29:42.059536 IP 192.168.1.95.56534 > 52.34.107.172.443: Flags [P.], seq 2033:3227, ack 3486, win 321, options [nop,nop,TS val 4146772920 ecr 3069638943], length 1194
00:29:42.072963 IP 117.18.237.29.80 > 192.168.1.95.41222: Flags [.], ack 451, win 285, options [nop,nop,TS val 3831740735 ecr 2078779479], length 0
00:29:42.073243 IP 183.232.231.172.443 > 192.168.1.95.40956: Flags [.], seq 9784:11236, ack 1139, win 844, length 1452
00:29:42.073253 IP 192.168.1.95.40956 > 183.232.231.172.443: Flags [.], ack 19948, win 592, options [nop,nop,sack 1 {9784:11236}], length 0
00:29:42.073439 IP 183.232.231.172.443 > 192.168.1.95.40956: Flags [.], seq 19948:21400, ack 1139, win 844, length 1452
00:29:42.073444 IP 192.168.1.95.40956 > 183.232.231.172.443: Flags [.], ack 21400, win 615, length 0
00:29:42.076453 IP 183.232.231.172.443 > 192.168.1.95.40956: Flags [.], seq 21400:24304, ack 1139, win 844, length 2904
00:29:42.076466 IP 192.168.1.95.40956 > 183.232.231.172.443: Flags [.], ack 24304, win 660, length 0
00:29:42.134472 IP 183.232.231.172.443 > 192.168.1.95.40956: Flags [.], seq 24304:27208, ack 1139, win 844, length 2904
00:29:42.134485 IP 192.168.1.95.40956 > 183.232.231.172.443: Flags [.], ack 27208, win 706, length 0
00:29:42.135390 IP 183.232.231.172.443 > 192.168.1.95.40956: Flags [.], seq 27208:30112, ack 1139, win 844, length 2904
00:29:42.135396 IP 192.168.1.95.40956 > 183.232.231.172.443: Flags [.], ack 30112, win 751, length 0
00:29:42.136224 IP 183.232.231.172.443 > 192.168.1.95.40956: Flags [.], seq 30112:31564, ack 1139, win 844, length 1452
00:29:42.136231 IP 192.168.1.95.40956 > 183.232.231.172.443: Flags [.], ack 31564, win 774, length 0
00:29:42.136291 IP 183.232.231.172.443 > 192.168.1.95.40956: Flags [.], seq 33016:34468, ack 1139, win 844, length 1452
00:29:42.136310 IP 192.168.1.95.40956 > 183.232.231.172.443: Flags [.], ack 31564, win 797, options [nop,nop,sack 1 {33016:34468}], length 0
00:29:42.136891 IP 183.232.231.172.443 > 192.168.1.95.40956: Flags [.], seq 34468:35920, ack 1139, win 844, length 1452
00:29:42.136897 IP 192.168.1.95.40956 > 183.232.231.172.443: Flags [.], ack 31564, win 820, options [nop,nop,sack 1 {33016:35920}], length 0
00:29:42.136958 IP 183.232.231.172.443 > 192.168.1.95.40956: Flags [.], seq 31564:33016, ack 1139, win 844, length 1452
00:29:42.136963 IP 192.168.1.95.40956 > 183.232.231.172.443: Flags [.], ack 35920, win 842, length 0
00:29:42.137572 IP 183.232.231.172.443 > 192.168.1.95.40956: Flags [.], seq 35920:38824, ack 1139, win 844, length 2904
00:29:42.137577 IP 192.168.1.95.40956 > 183.232.231.172.443: Flags [.], ack 38824, win 888, length 0
00:29:42.138229 IP 183.232.231.172.443 > 192.168.1.95.40956: Flags [.], seq 38824:40276, ack 1139, win 844, length 1452
00:29:42.138236 IP 192.168.1.95.40956 > 183.232.231.172.443: Flags [.], ack 40276, win 911, length 0
00:29:42.183019 IP 183.232.231.172.443 > 192.168.1.95.40956: Flags [.], seq 41728:43180, ack 1139, win 844, length 1452
00:29:42.183070 IP 192.168.1.95.40956 > 183.232.231.172.443: Flags [.], ack 40276, win 933, options [nop,nop,sack 1 {41728:43180}], length 0
00:29:42.183135 IP 183.232.231.172.443 > 192.168.1.95.40956: Flags [.], seq 40276:41728, ack 1139, win 844, length 1452
00:29:42.183145 IP 192.168.1.95.40956 > 183.232.231.172.443: Flags [.], ack 43180, win 956, length 0
00:29:42.184323 IP 183.232.231.172.443 > 192.168.1.95.40956: Flags [P.], seq 43180:45303, ack 1139, win 844, length 2123
00:29:42.184327 IP 192.168.1.95.40956 > 183.232.231.172.443: Flags [.], ack 45303, win 989, length 0
00:29:42.337029 IP 192.168.1.95.51695 > 192.168.1.1.53: 58396+ A? ss1.bdstatic.com. (34)
00:29:42.337192 IP 192.168.1.95.51695 > 192.168.1.1.53: 50336+ AAAA? ss1.bdstatic.com. (34)
00:29:42.362193 IP 52.34.107.172.443 > 192.168.1.95.56534: Flags [P.], seq 3486:3696, ack 3227, win 137, options [nop,nop,TS val 3069639073 ecr 4146772920], length 210
00:29:42.362270 IP 192.168.1.95.56534 > 52.34.107.172.443: Flags [.], ack 3696, win 343, options [nop,nop,TS val 4146773223 ecr 3069639073], length 0
00:29:42.401562 IP 192.168.1.1.53 > 192.168.1.95.51695: 58396 3/0/0 CNAME sslbdstatic.jomodns.com., A 112.49.48.32, A 112.49.51.32 (165)
00:29:42.402576 IP 192.168.1.1.53 > 192.168.1.95.51695: 50336 1/0/0 CNAME sslbdstatic.jomodns.com. (87)
00:29:42.403092 IP 192.168.1.95.60960 > 112.49.48.32.443: Flags [S], seq 2567070858, win 29200, options [mss 1460,sackOK,TS val 1971269742 ecr 0,nop,wscale 7], length 0
